{"document_type":"target_slot_declaration/1","execution_status":"DECLARED_NOT_EXECUTABLE","order":["slot_1","slot_2","slot_3"],"slot_1":{"absence_reason":null,"presence":"REFERENCED","reference_id":"ref-alpha","slot":"slot_1"},"slot_2":{"absence_reason":"NO_REFERENCE_SUPPLIED","presence":"ABSENT","reference_id":null,"slot":"slot_2"},"slot_3":{"absence_reason":null,"presence":"REFERENCED","reference_id":"ref-gamma","slot":"slot_3"}}
